{"schemaVersion":"1.0","assetId":"forzy-motor-01","queryFingerprint":"sha256:aaaaaaaaaaaaaaaaaaaaaaaaaaaaaaaaaaaaaaaaaaaaaaaaaaaaaaaaaaaaaaaa","activeHistoricalBatchId":null,"requestedRange":{"from":null,"to":null},"effectiveRange":null,"availableRange":null,"aggregationSummary":{"requestedMaxPoints":40,"originalPointCount":0,"returnedPointCount":0,"omittedPointCount":0,"reducedSeriesCount":0},"segments":[],"gaps":[],"operatingCycles":[],"series":[],"eventCandidates":[],"capabilities":{"historical":false,"live":true}}
